Dataset_ID	Variable	Unique_Summary	Num_Unique
GSE62944_Tumor	er_status_by_ihc	Negative, Positive, Indeterminate, NA	4
GSE62944_Tumor	ethnicity	NOT HISPANIC OR LATINO, NA, HISPANIC OR LATINO	3
GSE62944_Tumor	gender	FEMALE, MALE	2
GSE62944_Tumor	her2_ihc_score	3+, 1+, NA, 2+, 0	5
GSE62944_Tumor	her2_status_by_ihc	Positive, Negative, Equivocal, NA, Indeterminate	5
GSE62944_Tumor	histological_type	Infiltrating Ductal Carcinoma, Mucinous Carcinoma, Infiltrating Lobular Carcinoma, Mixed Histology (please specify), Other  specify, Medullary Carcinoma, Metaplastic Carcinoma, NA, Infiltrating Carcinoma NOS	9
GSE62944_Tumor	history_neoadjuvant_treatment	No, Yes, NA	3
GSE62944_Tumor	history_other_malignancy	No, Yes	2
GSE62944_Tumor	icd_10	C50.9, C50.3, C50.8, C50.2, C50.919, C50.5, C50.4	7
GSE62944_Tumor	icd_o_3_histology	8500/3, 8480/3, 8520/3, 8522/3, 8523/3, 8490/3, 8575/3, 9020/3, 8510/3, 8050/3, 8541/3, 8090/3, 8507/3, 8503/3, 8022/3, 8524/3, 8201/3, 8013/3, 8200/3, 8211/3, 8502/3, 8401/3, 8010/3	23
GSE62944_Tumor	margin_status	Negative, Positive, NA, Close	4
GSE62944_Tumor	menopause_status	Post (prior bilateral ovariectomy OR >12 mo since LMP with no prior hysterectomy), Pre (<6 months since LMP AND no prior bilateral ovariectomy AND not on estrogen replacement), NA, Indeterminate (neither Pre or Postmenopausal), Peri (6-12 months since last menstrual period)	5
GSE62944_Tumor	method_initial_path_dx	Core needle biopsy, Tumor resection, Incisional Biopsy, NA, Fine needle aspiration biopsy, Other method, specify:, Excisional Biopsy, Cytology (e.g. Peritoneal or pleural fluid)	8
GSE62944_Tumor	micromet_detection_by_ihc	NO, YES, NA	3
GSE62944_Tumor	patient_id	A0T1, A3J0, A126, A14X, A0TP, A15S, A1FW, A2OB, A0I1, A440, A14T, A740, A5IZ, A1N5, A18L, A2DC, A1NC, A0C0, A0EU, A24U, A096, A1PG, A1XJ, A082, A3KD, A2DK, A0WY, A159, A06P, A18R, A1AU, A273, A6FQ, A295, A1FJ, A105, A07Z, A3IZ, A0IJ, A2DM, A15O, A1F8, A2C9, A1AK, A14P, A1EN, A0TR, A132, A1OV, A3XV, A1EU, A1L9, A1JE, A1B0, A2LE, A0RL, A2BM, A0W5, A1JL, A0WW, A046, A0C1, A1EV, A0DH, A3HO, A0U0, A1ND, A1AX, A3X8, A07R, A1XU, A5YP, A1RH, A1XK, A5RW, A097, A4S1, A0DO, A0EP, A97C, A085, A0HN, A27I, A24N, A5QP, A0SM, A0A1, A1AR, A092, A6ZF, A1OX, A03Y, A1HL, A10F, A0JD, A6SA, AAT1, A1RB, A0YH, A0X1, A25B, A0RU, A1J5, A2FG, A124, A1JK, A0XW, A0AY, A091, A1XF, A278, A5QQ, A1XA, A0U4, A06U, A3W5, A1J2, A0E7, A3XN, A0ST, A23C, A04N, A0YF, A5UO, A6FP, A1JG, A1P4, A08C, A1G4, A26Y, A04H, A0GY, A09M, A0G0, A108, A209, A54O, A5J0, A1FV, A2FR, A0HK, A0XT, A1IZ, A0XO, A56Z, A15G, A18K, A0B9, A3Z5, A03T, A5YL, A2NL, A66O, A18P, A2DD, A2C8, A0J9, A0ER, A0EM, A06O, A1NI, A3YJ, A254, A7VC, A5D6, A2FM, A208, A0EE, A66K, A1JI, A1XM, A22B, A1XD, A07S, A9QF, A25C, A1R2, A1AM, A27F, A3U0, A1KI, A13F, A1AO, A24L, A08X, A07G, A0E2, A0YL, A0EB, A0JG, A0ET, A1KT, AA10, AALI, A5ZW, A204, A0TQ, A0CM, A2KD, A5RU, A6HE, A09B, A6VR, A1B5, A1NE, A25F, A140, A08J, A0BJ, A0J6, A0SE, A04U, A0BZ, A09X, A1IY, A08G, A252, A27N, A0FD, A6VW, A14S, A400, A12H, A0CU, A1JP, A27V, A5RZ, A0BM, A041, A6IW, A6R9, A0BQ, A1ET, AAT0, A0XR, A1FX, A2LO, A0CK, A0HF, A09V, A1LH, A0WS, A1X6, A73W, A1IK, A0IQ, A1X8, A24A, A1OW, A0SO, A0B3, A106, A22E, A07J, A1RD, A2DF, A1II, A083, A138, A0T5, A1XS, A5Q2, A22H, A5FK, A084, A402, A09N, A0BR, A0CG, A1G1, A03O, A0IH, A04P, A5QM, A9Q3, A0SU, A10A, A0E6, A1AZ, A1R0, A15D, A1XY, A9RU, A8HP, A129, A0SQ, A1N8, A1XV, A5D8, A24H, A0ES, A226, A0AM, A1FL, A89A, A18F, A8FY, A4S0, A0HL, A1XQ, A07W, A1FC, A2LM, A93S, A42T, A1N6, A0YD, A0SF, A2DH, A0J4, A08P, A0J3, A250, A0HU, A1FG, A408, A12D, A04C, A0WA, A2LR, A0SW, A27T, A12N, A0I2, A1OZ, A1FU, A23E, A156, A1Y2, A86G, A8HQ, A1HE, A3XY, A424, A0RE, A04T, A1LE, AAAK, A1FD, A0YE, A1FR, A4RW, A1PF, A128, A3M7, A1JS, A256, A0XL, A229, A8R6, A1XO, A1F0, A08R, A1EX, A6VV, A0RS, A0FL, A243, A0SP, A62V, A12E, A14N, A1R3, A2DI, A7W6, A1LS, A27K, A0J8, A0CO, A1L7, A133, A0DS, A09I, A134, A4E4, A3ZX, A1NG, A15F, A1R4, A0X0, A09E, A0SK, A0SB, A12T, A27M, A1R7, A18S, A0IC, A54X, A22A, A6R8, A2P5, A62X, A03X, A3BB, A0RX, A1OY, A50Y, A0XS, A1XR, A12G, A6FR, A12M, A0EO, A24X, A0CS, A08I, A0AT, A9QA, AA14, A26W, A1G0, A4S2, A1HO, A0FS, A04Y, A12Q, A1JU, A3E8, A1IO, A0BS, A12Z, A1P8, A1AS, A3W6, A08Z, A12Y, A259, A04J, A0H6, A1KO, A1XZ, A8LY, A1XL, A24Q, A09T, A2FV, A1BD, A0FV, A0HQ, A0XV, A12C, A5DA, A1P7, A0JE, A0IP, A27W, A154, A228, A0TT, A66N, A0T3, A2QJ, A1J1, A7T0, A66I, A3QA, A08F, A0TU, A1JM, A0BV, A0RN, A1X7, A143, A0CE, A66L, A2LK, A04D, A574, A2L8, A7VB, A0IK, A441, A1JJ, A66H, A5PV, A5PX, A0CT, A2DN, A1BC, A42U, A0TY, A5DD, A0A7, A1IW, A2B8, A0B0, A0RP, A3XU, A409, A12V, A1FN, A049, A18I, A3M8, AA11, A04V, A576, A0BC, A1B1, A07F, A0SV, A7SZ, A0AR, A03V, A0DQ, A4SA, A1RC, AA12, A1H3, A135, A0D9, A0X7, A0WV, A0HX, A1FM, A4RY, A1B4, A1KF, A3Y0, A1AJ, A14Z, A0X4, A14W, A3Q9, A095, A0YM, A0A4, A4SD, A245, A2LQ, A0B8, A0AW, A1RF, A1HM, A14V, A26Z, A12W, A0HI, A26X, A03N, A1IE, A0FJ, A12O, A73Y, A251, A5D7, A07E, A24V, A24O, A0D0, A0W3, A23G, A1L6, A0A2, A0H5, A08O, A09A, A18T, A094, A0IE, A0DX, A244, A0CX, A0FZ, A26H, A1LA, A1F5, AA0Z, A1IH, A0FX, A1P6, A3KC, A18H, A2DO, A1F2, A1FB, A1X5, A0HA, A0AZ, A2LN, A2LJ, A2JS, A12U, A0RO, A0TV, A07I, A0W7, A0JF, A0CL, A0EX, A899, A247, A1HJ, A1XT, A442, A24M, A202, A0DV, A28Q, A25E, A0EA, A0EN, A1IF, A8F5, A12L, A8OS, A147, A09Q, A6ZH, A25A, A2LL, A08A, A1IN, A10C, A24Z, A14Y, A5RV, A74U, A0BT, A1NF, A18J, A573, A1LL, A1KC, A0FT, A4SC, A13H, A0HY, A5DC, A6VQ, A0X5, A3XT, A28O, A0IM, A5YN, A06T, A1J9, A401, A158, A1AP, A076, A22D, A10E, A0I9, AAZ6, A2BK, A0SX, A0CQ, A0CP, A24P, A1P3, AA15, A3NW, A27B, A0CZ, A1AT, AB41, A0AS, A27G, A09C, A0U3, A73X, A3TN, A1HG, A0EY, A15I, A1IL, A0SD, A0YG, A5XS, A1XB, A1Y1, A22G, A04L, A0TX, A3HN, A54N, A13Z, A07O, A15C, A0RI, A1G6, A27H, A03U, A0JM, A1NA, A04A, A7U7, A1JA, A14Q, A153, A255, A0AJ, A0RQ, A03L, A3XZ, A0GZ, A6VX, A0SH, A1JT, A03R, A8OQ, A0YK, A0B1, A0H3, A1XC, A06N, A2FO, A0CJ, A0DZ, A2FS, A40C, A18G, A2P6, A2FK, A1Y3, A0B4, A150, A12X, A203, A73U, A0W4, A0DD, A4S3, A04Q, A130, A0RT, A8LZ, A0FN, A0I8, A0D1, A27L, A08B, A1P0, A1LG, A274, A109, A4SF, A1H2, A08T, A107, A40B, A0TW, A0HB, A0E0, A0J5, A1HI, A0HW, A0TS, A0JL, A3YW, A27E, A1EO, A0YT, A079, A8R5, A0CD, A1RI, A06R, A1JN, A15H, A0J2, A23H, A5ZX, A14R, A18N, A06Y, A12P, A0BP, A6VO, A0JC, A26V, A0CR, A3DX, A2DA, A66U, A0Y5, A0C3, A075, A06Q, A0RM, A8FZ, A0A6, A3Z6, A425, A6VY, A6IV, A0DA, A18Q, A4RX, A0WZ, A04R, A1AN, A0IG, A10B, A0YC, A570, A572, A1RE, A0SG, A1HK, A1R6, A0JA, A1LK, A07C, A5DE, A152, A0IN, A0FK, A2FW, A423, A1Y0, A12A, A0DE, A1AY, A0XU, A1F6, A099, A1AW, A0EQ, A3NY, A086, A1FZ, A3XG, A04W, A0XN, A1KP, A3YI, A07L, A8OP, AA17, A1LB, A1PD, A0D2, A62Y, A0JI, A0IO, A0T7, A1R5, A1NH, A24W, A6NO, A8OR, A4SE, A08L, A09G, A25D, AB44, A27P, A0I6, A0RV, A04X, A1RA, A3QP, A3IY, A0SN, A5RY, A1N4, A137, A1PC, A07U, A2D9, A1PE, A0FW, A145, A1AI, A1KQ, A15T, A6ZG, A0CW, AALJ, A081, A03P, A142, A24S, A24K, A0BL, A1EY, A1N9, A3XW, A0B5, A0T2, A1KN, A3RF, A14O, A0T6, A8G0, A1FH, A0IB, A1N3, A0D4, A0EI, A0IA, A3YX, A09W, A0BF, A131, A0B7, A1AL, A0CH, A1J8, A09D, A5RX, A0DT, A4Z1, A1IG, A0WT, A1PB, A0CY, A1JD, A0DI, A0H9, A1QZ, A3J1, A155, A4SB, A0H0, A7W5, A0AK, A1P1, A5ZV, A09Z, A093, A0EV, A1IJ, A0FF, A0RG, A12F, A0HP, A201, A54Y, A2FB, A0AB, A8LV, A1AQ, A2QI, A1HF, A15J, A0AL, A0H7, A2FF, A1HN, A66J, A0T0, A1AV, A0SJ, A0DL, A73Z, A0JB, A0B2, A0SY, A0D3, A0DK, A1IU, A3XX, A2LH, A1XG, A1KS, A66P, A5UP, A12K, A5S0, A0BW, A249, A07P, A09K, A146, A1J6, A125, A1B6, A0AU, A0AV, A07B, A0TZ, A1X9, A1JF, A1XW, A1JC, A5YO, A0SI, A2IU, A06Z, A0E1, A5YM, A0JJ, A0BD, A0BA, A0DG, A24T, A08S, A1P5, A426, A0YI, A4E0, A0I5, A3XL, A227, A0RH, A27R, A0BG, A1PH, A0E9, A14U, A0XP, A275, A12B, A8HR, A15L, A1PA, A3XS, A0DP, A18U, A51U, A0B6, A13Y, A0BO, A06X, A1JB, A15M, AAAU, A0U2, A5QN, A0HO, A18M, A1IX, A1JH, A1L8, A15R, A1J3, A141, A03M, A56D, A248, A24R, A2DB, A26G, A15P, AB28, A0FY, A8LX, A42V, A0AD, AALK, A2JT, A1KR, A0A9, A6S9, A08H, A0J7, A27A, A0CV, A0EW, A090, A1LI, A5FL, A0WX, A0YJ, A0T4, A1AH, A1RG, A2DL, A09R, A0C7, A1EW	1065
GSE62944_Tumor	Platform_ID	GPL9052	1
GSE62944_Tumor	pr_status_by_ihc	Negative, Positive, NA, Indeterminate	4
GSE62944_Tumor	race	AMERICAN INDIAN OR ALASKA NATIVE, WHITE, ASIAN, BLACK OR AFRICAN AMERICAN, NA	5
GSE62944_Tumor	surgical_procedure_first	Lumpectomy, Simple Mastectomy, Other, Modified Radical Mastectomy, NA	5
GSE62944_Tumor	tumor_status	TUMOR FREE, NA, WITH TUMOR	3
GSE62944_Tumor	vital_status	Alive, Dead	2
