Dataset_ID	Variable	Unique_Summary	Num_Unique
GSE62944_Tumor	ajcc_metastasis_pathologic_pm	M0, MX, cM0 (i+), M1	4
GSE62944_Tumor	ajcc_nodes_pathologic_pn	N3, N0, N0 (i-), N2, N1, N2a, N1a, N1mi, N1b, N0 (i+), NX, N3a, N3c, N3b, N1c, N0 (mol+)	16
GSE62944_Tumor	ajcc_pathologic_tumor_stage	Stage IIIC, Stage IIA, Stage IIIA, Stage IIB, Stage IA, Stage I, Stage IIIB, Stage X, Stage II, Stage IV, Stage IB, Stage III, Stage Tis, NA	14
GSE62944_Tumor	ajcc_staging_edition	NA, 7th, 6th, 5th, 4th	5
GSE62944_Tumor	ajcc_tumor_pathologic_pt	T3, T2, T1c, T1, T2b, T4b, T1b, T4d, T2a, TX, T1a, T4, T3a	13
GSE62944_Tumor	anatomic_neoplasm_subdivision	Right Upper Outer Quadrant, Right, Right Upper Inner Quadrant|Right, Left Upper Inner Quadrant, Left Upper Inner Quadrant|Left Upper Outer Quadrant, Right|Right Lower Outer Quadrant, Left Upper Outer Quadrant, Left, Right Upper Inner Quadrant, Left Upper Outer Quadrant|Left, Right Lower Outer Quadrant, Left Upper Outer Quadrant|Left Lower Outer Quadrant, Left Lower Inner Quadrant|Left Lower Outer Quadrant, Left Lower Inner Quadrant|Left, Left Lower Outer Quadrant, Right Upper Inner Quadrant|Right Upper Outer Quadrant, Right Upper Outer Quadrant|Right, Left Lower Inner Quadrant, Right Lower Inner Quadrant, Right|Right Lower Inner Quadrant, Left Upper Inner Quadrant|Left Upper Outer Quadrant|Left, Right|Right Upper Outer Quadrant, Left|Left Lower Inner Quadrant, Left Lower Outer Quadrant|Left, Left|Left Upper Outer Quadrant, Right Lower Inner Quadrant|Right Lower Outer Quadrant|Right, Right|Right Upper Inner Quadrant, Right Upper Inner Quadrant|Right Upper Outer Quadrant|Right, Left Upper Inner Quadrant|Left Lower Inner Quadrant, Left Upper Inner Quadrant|Left Upper Outer Quadrant|Left Lower Inner Quadrant|Left Lower Outer Quadrant, Right Lower Inner Quadrant|Right, Right Lower Outer Quadrant|Right, Right Upper Outer Quadrant|Right Lower Outer Quadrant, Right Lower Inner Quadrant|Right Lower Outer Quadrant, Left|Left Upper Outer Quadrant|Left Lower Outer Quadrant, Right|Right Upper Inner Quadrant|Right Upper Outer Quadrant|Right Lower Inner Quadrant|Right Lower Outer Quadrant, Right Upper Inner Quadrant|Right Upper Outer Quadrant|Right Lower Inner Quadrant|Right Lower Outer Quadrant|Right, Right Upper Inner Quadrant|Right Lower Inner Quadrant, Right Upper Inner Quadrant|Right Lower Inner Quadrant|Right, Left Upper Outer Quadrant|Left Lower Outer Quadrant|Left, Left Upper Inner Quadrant|Left, Left|Left Upper Inner Quadrant|Left Lower Inner Quadrant, Left Upper Inner Quadrant|Left Upper Outer Quadrant|Left Lower Inner Quadrant|Left Lower Outer Quadrant|Left, Right Upper Outer Quadrant|Right Lower Inner Quadrant|Right Lower Outer Quadrant, Left Upper Inner Quadrant|Left Lower Inner Quadrant|Left Lower Outer Quadrant|Left, Left Upper Outer Quadrant|Left Lower Inner Quadrant|Left Lower Outer Quadrant, Left Lower Inner Quadrant|Left Lower Outer Quadrant|Left, Right Upper Outer Quadrant|Right Lower Outer Quadrant|Right, Left Upper Inner Quadrant|Left Upper Outer Quadrant|Left Lower Inner Quadrant|Left, Left Upper Inner Quadrant|Left Upper Outer Quadrant|Left Lower Outer Quadrant|Left, Left|Left Upper Inner Quadrant, Left|Left Upper Inner Quadrant|Left Upper Outer Quadrant|Left Lower Inner Quadrant|Left Lower Outer Quadrant, Left Upper Inner Quadrant|Left Lower Inner Quadrant|Left	53
GSE62944_Tumor	axillary_staging_method	Axillary lymph node dissection alone, Sentinel node biopsy alone, Sentinel lymph node biopsy plus axillary dissection, NA, No axillary staging, Other (specify)	6
GSE62944_Tumor	bcr_patient_barcode	TCGA-A2-A0T1, TCGA-A7-A3J0, TCGA-AO-A126, TCGA-E2-A14X, TCGA-AR-A0TP, TCGA-E2-A15S, TCGA-A2-A1FW, TCGA-HN-A2OB, TCGA-B6-A0I1, TCGA-LL-A440, TCGA-E2-A14T, TCGA-LL-A740, TCGA-BH-A5IZ, TCGA-E9-A1N5, TCGA-BH-A18L, TCGA-GM-A2DC, TCGA-E9-A1NC, TCGA-BH-A0C0, TCGA-A2-A0EU, TCGA-AR-A24U, TCGA-A8-A096, TCGA-EW-A1PG, TCGA-D8-A1XJ, TCGA-A8-A082, TCGA-A2-A3KD, TCGA-GM-A2DK, TCGA-B6-A0WY, TCGA-E2-A159, TCGA-A8-A06P, TCGA-BH-A18R, TCGA-AR-A1AU, TCGA-C8-A273, TCGA-LL-A6FQ, TCGA-E9-A295, TCGA-BH-A1FJ, TCGA-E2-A105, TCGA-A8-A07Z, TCGA-A7-A3IZ, TCGA-B6-A0IJ, TCGA-GM-A2DM, TCGA-E2-A15O, TCGA-BH-A1F8, TCGA-GI-A2C9, TCGA-AR-A1AK, TCGA-E2-A14P, TCGA-BH-A1EN, TCGA-AR-A0TR, TCGA-C8-A132, TCGA-EW-A1OV, TCGA-A2-A3XV, TCGA-BH-A1EU, TCGA-E2-A1L9, TCGA-D8-A1JE, TCGA-E2-A1B0, TCGA-AR-A2LE, TCGA-B6-A0RL, TCGA-AC-A2BM, TCGA-BH-A0W5, TCGA-D8-A1JL, TCGA-B6-A0WW, TCGA-AN-A046, TCGA-BH-A0C1, TCGA-BH-A1EV, TCGA-BH-A0DH, TCGA-E9-A3HO, TCGA-AR-A0U0, TCGA-E9-A1ND, TCGA-AR-A1AX, TCGA-E9-A3X8, TCGA-A8-A07R, TCGA-D8-A1XU, TCGA-LL-A5YP, TCGA-E9-A1RH, TCGA-D8-A1XK, TCGA-OL-A5RW, TCGA-A8-A097, TCGA-A2-A4S1, TCGA-BH-A0DO, TCGA-A2-A0EP, TCGA-OL-A97C, TCGA-A8-A085, TCGA-BH-A0HN, TCGA-D8-A27I, TCGA-AR-A24N, TCGA-AR-A5QP, TCGA-A1-A0SM, TCGA-A8-A0A1, TCGA-AR-A1AR, TCGA-A8-A092, TCGA-S3-A6ZF, TCGA-EW-A1OX, TCGA-AN-A03Y, TCGA-C8-A1HL, TCGA-E2-A10F, TCGA-AO-A0JD, TCGA-EW-A6SA, TCGA-5L-AAT1, TCGA-E9-A1RB, TCGA-A2-A0YH, TCGA-B6-A0X1, TCGA-A2-A25B, TCGA-B6-A0RU, TCGA-EW-A1J5, TCGA-AC-A2FG, TCGA-AO-A124, TCGA-D8-A1JK, TCGA-AN-A0XW, TCGA-BH-A0AY, TCGA-A8-A091, TCGA-D8-A1XF, TCGA-C8-A278, TCGA-AR-A5QQ, TCGA-D8-A1XA, TCGA-AR-A0U4, TCGA-A8-A06U, TCGA-AC-A3W5, TCGA-EW-A1J2, TCGA-BH-A0E7, TCGA-GM-A3XN, TCGA-A2-A0ST, TCGA-AC-A23C, TCGA-A2-A04N, TCGA-A2-A0YF, TCGA-E9-A5UO, TCGA-LL-A6FP, TCGA-D8-A1JG, TCGA-EW-A1P4, TCGA-A8-A08C, TCGA-A2-A1G4, TCGA-C8-A26Y, TCGA-AQ-A04H, TCGA-BH-A0GY, TCGA-A8-A09M, TCGA-AN-A0G0, TCGA-E2-A108, TCGA-BH-A209, TCGA-AQ-A54O, TCGA-BH-A5J0, TCGA-A2-A1FV, TCGA-EW-A2FR, TCGA-BH-A0HK, TCGA-AN-A0XT, TCGA-EW-A1IZ, TCGA-AN-A0XO, TCGA-E2-A56Z, TCGA-E2-A15G, TCGA-BH-A18K, TCGA-BH-A0B9, TCGA-D8-A3Z5, TCGA-AO-A03T, TCGA-LL-A5YL, TCGA-HN-A2NL, TCGA-OL-A66O, TCGA-BH-A18P, TCGA-GM-A2DD, TCGA-GI-A2C8, TCGA-AO-A0J9, TCGA-A2-A0ER, TCGA-A2-A0EM, TCGA-A8-A06O, TCGA-E9-A1NI, TCGA-AC-A3YJ, TCGA-AR-A254, TCGA-AC-A7VC, TCGA-OL-A5D6, TCGA-AC-A2FM, TCGA-BH-A208, TCGA-BH-A0EE, TCGA-OL-A66K, TCGA-D8-A1JI, TCGA-D8-A1XM, TCGA-E9-A22B, TCGA-D8-A1XD, TCGA-A8-A07S, TCGA-LD-A9QF, TCGA-A2-A25C, TCGA-E9-A1R2, TCGA-AR-A1AM, TCGA-D8-A27F, TCGA-EW-A3U0, TCGA-B6-A1KI, TCGA-A7-A13F, TCGA-AR-A1AO, TCGA-AR-A24L, TCGA-A8-A08X, TCGA-A8-A07G, TCGA-BH-A0E2, TCGA-A2-A0YL, TCGA-BH-A0EB, TCGA-AO-A0JG, TCGA-A2-A0ET, TCGA-AO-A1KT, TCGA-S3-AA10, TCGA-3C-AALI, TCGA-A7-A5ZW, TCGA-BH-A204, TCGA-AR-A0TQ, TCGA-A2-A0CM, TCGA-A7-A2KD, TCGA-OL-A5RU, TCGA-E9-A6HE, TCGA-A8-A09B, TCGA-OL-A6VR, TCGA-E2-A1B5, TCGA-E9-A1NE, TCGA-A2-A25F, TCGA-D8-A140, TCGA-A8-A08J, TCGA-BH-A0BJ, TCGA-AO-A0J6, TCGA-A1-A0SE, TCGA-A2-A04U, TCGA-BH-A0BZ, TCGA-A8-A09X, TCGA-EW-A1IY, TCGA-A8-A08G, TCGA-AR-A252, TCGA-D8-A27N, TCGA-AN-A0FD, TCGA-A7-A6VW, TCGA-E2-A14S, TCGA-B6-A400, TCGA-AO-A12H, TCGA-A2-A0CU, TCGA-D8-A1JP, TCGA-D8-A27V, TCGA-OL-A5RZ, TCGA-BH-A0BM, TCGA-AN-A041, TCGA-AC-A6IW, TCGA-BH-A6R9, TCGA-BH-A0BQ, TCGA-BH-A1ET, TCGA-5L-AAT0, TCGA-AN-A0XR, TCGA-A2-A1FX, TCGA-AR-A2LO, TCGA-A2-A0CK, TCGA-BH-A0HF, TCGA-A8-A09V, TCGA-E2-A1LH, TCGA-B6-A0WS, TCGA-D8-A1X6, TCGA-D8-A73W, TCGA-E2-A1IK, TCGA-B6-A0IQ, TCGA-D8-A1X8, TCGA-E9-A24A, TCGA-EW-A1OW, TCGA-A1-A0SO, TCGA-BH-A0B3, TCGA-E2-A106, TCGA-E9-A22E, TCGA-A8-A07J, TCGA-E9-A1RD, TCGA-GM-A2DF, TCGA-E2-A1II, TCGA-A8-A083, TCGA-C8-A138, TCGA-A2-A0T5, TCGA-D8-A1XS, TCGA-OK-A5Q2, TCGA-E9-A22H, TCGA-E9-A5FK, TCGA-A8-A084, TCGA-B6-A402, TCGA-A8-A09N, TCGA-BH-A0BR, TCGA-A7-A0CG, TCGA-A2-A1G1, TCGA-AO-A03O, TCGA-B6-A0IH, TCGA-A2-A04P, TCGA-AR-A5QM, TCGA-LL-A9Q3, TCGA-A2-A0SU, TCGA-E2-A10A, TCGA-BH-A0E6, TCGA-E2-A1AZ, TCGA-E9-A1R0, TCGA-E2-A15D, TCGA-D8-A1XY, TCGA-E2-A9RU, TCGA-C8-A8HP, TCGA-AO-A129, TCGA-A1-A0SQ, TCGA-E9-A1N8, TCGA-D8-A1XV, TCGA-OL-A5D8, TCGA-AR-A24H, TCGA-A2-A0ES, TCGA-E9-A226, TCGA-AN-A0AM, TCGA-BH-A1FL, TCGA-XX-A89A, TCGA-BH-A18F, TCGA-BH-A8FY, TCGA-A2-A4S0, TCGA-BH-A0HL, TCGA-D8-A1XQ, TCGA-A8-A07W, TCGA-BH-A1FC, TCGA-AR-A2LM, TCGA-UU-A93S, TCGA-BH-A42T, TCGA-E9-A1N6, TCGA-A2-A0YD, TCGA-A1-A0SF, TCGA-GM-A2DH, TCGA-AO-A0J4, TCGA-A8-A08P, TCGA-AO-A0J3, TCGA-AR-A250, TCGA-BH-A0HU, TCGA-BH-A1FG, TCGA-B6-A408, TCGA-AO-A12D, TCGA-AN-A04C, TCGA-BH-A0WA, TCGA-AR-A2LR, TCGA-A2-A0SW, TCGA-D8-A27T, TCGA-C8-A12N, TCGA-B6-A0I2, TCGA-EW-A1OZ, TCGA-BH-A1FU, TCGA-AC-A23E, TCGA-E2-A156, TCGA-D8-A1Y2, TCGA-W8-A86G, TCGA-C8-A8HQ, TCGA-C8-A1HE, TCGA-A2-A3XY, TCGA-EW-A424, TCGA-B6-A0RE, TCGA-A2-A04T, TCGA-E2-A1LE, TCGA-4H-AAAK, TCGA-BH-A1FD, TCGA-A2-A0YE, TCGA-BH-A1FR, TCGA-A2-A4RW, TCGA-EW-A1PF, TCGA-AO-A128, TCGA-C8-A3M7, TCGA-D8-A1JS, TCGA-AR-A256, TCGA-AN-A0XL, TCGA-E9-A229, TCGA-Z7-A8R6, TCGA-D8-A1XO, TCGA-BH-A1F0, TCGA-A8-A08R, TCGA-BH-A1EX, TCGA-A7-A6VV, TCGA-B6-A0RS, TCGA-AN-A0FL, TCGA-E9-A243, TCGA-A1-A0SP, TCGA-AC-A62V, TCGA-AO-A12E, TCGA-E2-A14N, TCGA-E9-A1R3, TCGA-GM-A2DI, TCGA-LD-A7W6, TCGA-E2-A1LS, TCGA-D8-A27K, TCGA-AO-A0J8, TCGA-A2-A0CO, TCGA-E2-A1L7, TCGA-C8-A133, TCGA-BH-A0DS, TCGA-A8-A09I, TCGA-C8-A134, TCGA-LQ-A4E4, TCGA-B6-A3ZX, TCGA-E9-A1NG, TCGA-E2-A15F, TCGA-E9-A1R4, TCGA-B6-A0X0, TCGA-A8-A09E, TCGA-A1-A0SK, TCGA-A1-A0SB, TCGA-C8-A12T, TCGA-D8-A27M, TCGA-E9-A1R7, TCGA-BH-A18S, TCGA-B6-A0IC, TCGA-E9-A54X, TCGA-E9-A22A, TCGA-BH-A6R8, TCGA-E2-A2P5, TCGA-AC-A62X, TCGA-AN-A03X, TCGA-AC-A3BB, TCGA-BH-A0RX, TCGA-EW-A1OY, TCGA-LL-A50Y, TCGA-AN-A0XS, TCGA-D8-A1XR, TCGA-AO-A12G, TCGA-LL-A6FR, TCGA-C8-A12M, TCGA-A2-A0EO, TCGA-AR-A24X, TCGA-A2-A0CS, TCGA-A8-A08I, TCGA-AN-A0AT, TCGA-5T-A9QA, TCGA-S3-AA14, TCGA-C8-A26W, TCGA-A2-A1G0, TCGA-A2-A4S2, TCGA-C8-A1HO, TCGA-AN-A0FS, TCGA-A2-A04Y, TCGA-C8-A12Q, TCGA-D8-A1JU, TCGA-EW-A3E8, TCGA-E2-A1IO, TCGA-BH-A0BS, TCGA-C8-A12Z, TCGA-EW-A1P8, TCGA-AR-A1AS, TCGA-AC-A3W6, TCGA-A8-A08Z, TCGA-C8-A12Y, TCGA-A2-A259, TCGA-AQ-A04J, TCGA-BH-A0H6, TCGA-AO-A1KO, TCGA-D8-A1XZ, TCGA-PL-A8LY, TCGA-D8-A1XL, TCGA-AR-A24Q, TCGA-A8-A09T, TCGA-EW-A2FV, TCGA-E2-A1BD, TCGA-AN-A0FV, TCGA-BH-A0HQ, TCGA-AN-A0XV, TCGA-AO-A12C, TCGA-OL-A5DA, TCGA-EW-A1P7, TCGA-AO-A0JE, TCGA-B6-A0IP, TCGA-D8-A27W, TCGA-E2-A154, TCGA-E9-A228, TCGA-AR-A0TT, TCGA-OL-A66N, TCGA-A2-A0T3, TCGA-AC-A2QJ, TCGA-EW-A1J1, TCGA-LL-A7T0, TCGA-OL-A66I, TCGA-E9-A3QA, TCGA-A8-A08F, TCGA-AR-A0TU, TCGA-D8-A1JM, TCGA-BH-A0BV, TCGA-B6-A0RN, TCGA-D8-A1X7, TCGA-D8-A143, TCGA-A7-A0CE, TCGA-OL-A66L, TCGA-AR-A2LK, TCGA-AN-A04D, TCGA-E2-A574, TCGA-BH-A2L8, TCGA-AC-A7VB, TCGA-B6-A0IK, TCGA-LL-A441, TCGA-D8-A1JJ, TCGA-OL-A66H, TCGA-GM-A5PV, TCGA-GM-A5PX, TCGA-A2-A0CT, TCGA-GM-A2DN, TCGA-E2-A1BC, TCGA-BH-A42U, TCGA-AR-A0TY, TCGA-PE-A5DD, TCGA-A8-A0A7, TCGA-EW-A1IW, TCGA-AC-A2B8, TCGA-BH-A0B0, TCGA-B6-A0RP, TCGA-A2-A3XU, TCGA-B6-A409, TCGA-C8-A12V, TCGA-BH-A1FN, TCGA-AN-A049, TCGA-BH-A18I, TCGA-C8-A3M8, TCGA-S3-AA11, TCGA-A2-A04V, TCGA-E2-A576, TCGA-BH-A0BC, TCGA-E2-A1B1, TCGA-A8-A07F, TCGA-A2-A0SV, TCGA-LL-A7SZ, TCGA-AN-A0AR, TCGA-AO-A03V, TCGA-BH-A0DQ, TCGA-A7-A4SA, TCGA-E9-A1RC, TCGA-S3-AA12, TCGA-AQ-A1H3, TCGA-C8-A135, TCGA-A7-A0D9, TCGA-B6-A0X7, TCGA-B6-A0WV, TCGA-BH-A0HX, TCGA-BH-A1FM, TCGA-A2-A4RY, TCGA-E2-A1B4, TCGA-B6-A1KF, TCGA-A2-A3Y0, TCGA-AR-A1AJ, TCGA-E2-A14Z, TCGA-B6-A0X4, TCGA-E2-A14W, TCGA-E9-A3Q9, TCGA-A8-A095, TCGA-A2-A0YM, TCGA-A8-A0A4, TCGA-A7-A4SD, TCGA-E9-A245, TCGA-AR-A2LQ, TCGA-BH-A0B8, TCGA-BH-A0AW, TCGA-E9-A1RF, TCGA-C8-A1HM, TCGA-E2-A14V, TCGA-C8-A26Z, TCGA-C8-A12W, TCGA-BH-A0HI, TCGA-C8-A26X, TCGA-AO-A03N, TCGA-E2-A1IE, TCGA-AN-A0FJ, TCGA-C8-A12O, TCGA-LL-A73Y, TCGA-AR-A251, TCGA-OL-A5D7, TCGA-A8-A07E, TCGA-AR-A24V, TCGA-AR-A24O, TCGA-A2-A0D0, TCGA-BH-A0W3, TCGA-AC-A23G, TCGA-E2-A1L6, TCGA-A8-A0A2, TCGA-BH-A0H5, TCGA-A8-A08O, TCGA-A8-A09A, TCGA-BH-A18T, TCGA-A8-A094, TCGA-B6-A0IE, TCGA-BH-A0DX, TCGA-E9-A244, TCGA-A2-A0CX, TCGA-AN-A0FZ, TCGA-A7-A26H, TCGA-E2-A1LA, TCGA-BH-A1F5, TCGA-S3-AA0Z, TCGA-E2-A1IH, TCGA-AN-A0FX, TCGA-EW-A1P6, TCGA-A2-A3KC, TCGA-BH-A18H, TCGA-GM-A2DO, TCGA-BH-A1F2, TCGA-BH-A1FB, TCGA-D8-A1X5, TCGA-BH-A0HA, TCGA-BH-A0AZ, TCGA-AR-A2LN, TCGA-AR-A2LJ, TCGA-E9-A2JS, TCGA-C8-A12U, TCGA-B6-A0RO, TCGA-AR-A0TV, TCGA-A8-A07I, TCGA-BH-A0W7, TCGA-AO-A0JF, TCGA-A2-A0CL, TCGA-A2-A0EX, TCGA-XX-A899, TCGA-E9-A247, TCGA-C8-A1HJ, TCGA-D8-A1XT, TCGA-LL-A442, TCGA-AR-A24M, TCGA-BH-A202, TCGA-BH-A0DV, TCGA-BH-A28Q, TCGA-A2-A25E, TCGA-BH-A0EA, TCGA-A2-A0EN, TCGA-E2-A1IF, TCGA-LL-A8F5, TCGA-C8-A12L, TCGA-AC-A8OS, TCGA-D8-A147, TCGA-A8-A09Q, TCGA-S3-A6ZH, TCGA-A2-A25A, TCGA-AR-A2LL, TCGA-A8-A08A, TCGA-E2-A1IN, TCGA-E2-A10C, TCGA-AR-A24Z, TCGA-E2-A14Y, TCGA-OL-A5RV, TCGA-LD-A74U, TCGA-BH-A0BT, TCGA-E9-A1NF, TCGA-BH-A18J, TCGA-E2-A573, TCGA-E2-A1LL, TCGA-B6-A1KC, TCGA-AN-A0FT, TCGA-A7-A4SC, TCGA-A7-A13H, TCGA-BH-A0HY, TCGA-PE-A5DC, TCGA-OL-A6VQ, TCGA-B6-A0X5, TCGA-A2-A3XT, TCGA-BH-A28O, TCGA-B6-A0IM, TCGA-LL-A5YN, TCGA-A8-A06T, TCGA-D8-A1J9, TCGA-B6-A401, TCGA-E2-A158, TCGA-AR-A1AP, TCGA-A8-A076, TCGA-E9-A22D, TCGA-E2-A10E, TCGA-B6-A0I9, TCGA-UL-AAZ6, TCGA-AC-A2BK, TCGA-A2-A0SX, TCGA-A2-A0CQ, TCGA-A2-A0CP, TCGA-AR-A24P, TCGA-EW-A1P3, TCGA-S3-AA15, TCGA-GM-A3NW, TCGA-C8-A27B, TCGA-A2-A0CZ, TCGA-AR-A1AT, TCGA-WT-AB41, TCGA-AN-A0AS, TCGA-D8-A27G, TCGA-A8-A09C, TCGA-AR-A0U3, TCGA-D8-A73X, TCGA-AC-A3TN, TCGA-C8-A1HG, TCGA-A2-A0EY, TCGA-E2-A15I, TCGA-E2-A1IL, TCGA-A1-A0SD, TCGA-A2-A0YG, TCGA-AC-A5XS, TCGA-D8-A1XB, TCGA-D8-A1Y1, TCGA-E9-A22G, TCGA-AQ-A04L, TCGA-AR-A0TX, TCGA-AC-A3HN, TCGA-AQ-A54N, TCGA-D8-A13Z, TCGA-A8-A07O, TCGA-E2-A15C, TCGA-B6-A0RI, TCGA-A2-A1G6, TCGA-D8-A27H, TCGA-AO-A03U, TCGA-AO-A0JM, TCGA-E9-A1NA, TCGA-AN-A04A, TCGA-AQ-A7U7, TCGA-D8-A1JA, TCGA-E2-A14Q, TCGA-E2-A153, TCGA-AR-A255, TCGA-AN-A0AJ, TCGA-B6-A0RQ, TCGA-AO-A03L, TCGA-A2-A3XZ, TCGA-BH-A0GZ, TCGA-A7-A6VX, TCGA-A1-A0SH, TCGA-D8-A1JT, TCGA-AO-A03R, TCGA-AC-A8OQ, TCGA-A2-A0YK, TCGA-BH-A0B1, TCGA-BH-A0H3, TCGA-D8-A1XC, TCGA-A8-A06N, TCGA-AC-A2FO, TCGA-A7-A0CJ, TCGA-BH-A0DZ, TCGA-EW-A2FS, TCGA-B6-A40C, TCGA-BH-A18G, TCGA-E2-A2P6, TCGA-AC-A2FK, TCGA-D8-A1Y3, TCGA-BH-A0B4, TCGA-E2-A150, TCGA-C8-A12X, TCGA-BH-A203, TCGA-D8-A73U, TCGA-BH-A0W4, TCGA-BH-A0DD, TCGA-A2-A4S3, TCGA-A2-A04Q, TCGA-C8-A130, TCGA-B6-A0RT, TCGA-PL-A8LZ, TCGA-AN-A0FN, TCGA-B6-A0I8, TCGA-A2-A0D1, TCGA-D8-A27L, TCGA-A8-A08B, TCGA-EW-A1P0, TCGA-E2-A1LG, TCGA-C8-A274, TCGA-E2-A109, TCGA-A7-A4SF, TCGA-AQ-A1H2, TCGA-A8-A08T, TCGA-E2-A107, TCGA-B6-A40B, TCGA-AR-A0TW, TCGA-BH-A0HB, TCGA-BH-A0E0, TCGA-AO-A0J5, TCGA-C8-A1HI, TCGA-BH-A0HW, TCGA-AR-A0TS, TCGA-AO-A0JL, TCGA-JL-A3YW, TCGA-D8-A27E, TCGA-BH-A1EO, TCGA-A2-A0YT, TCGA-A8-A079, TCGA-Z7-A8R5, TCGA-A7-A0CD, TCGA-E9-A1RI, TCGA-A8-A06R, TCGA-D8-A1JN, TCGA-E2-A15H, TCGA-AO-A0J2, TCGA-AC-A23H, TCGA-A7-A5ZX, TCGA-E2-A14R, TCGA-BH-A18N, TCGA-A8-A06Y, TCGA-C8-A12P, TCGA-BH-A0BP, TCGA-OL-A6VO, TCGA-AO-A0JC, TCGA-C8-A26V, TCGA-A2-A0CR, TCGA-E2-A3DX, TCGA-GM-A2DA, TCGA-LD-A66U, TCGA-AQ-A0Y5, TCGA-BH-A0C3, TCGA-A8-A075, TCGA-A8-A06Q, TCGA-B6-A0RM, TCGA-BH-A8FZ, TCGA-A8-A0A6, TCGA-D8-A3Z6, TCGA-A7-A425, TCGA-A7-A6VY, TCGA-AC-A6IV, TCGA-A7-A0DA, TCGA-BH-A18Q, TCGA-A2-A4RX, TCGA-B6-A0WZ, TCGA-A2-A04R, TCGA-AR-A1AN, TCGA-B6-A0IG, TCGA-E2-A10B, TCGA-A2-A0YC, TCGA-E2-A570, TCGA-E2-A572, TCGA-E9-A1RE, TCGA-A1-A0SG, TCGA-C8-A1HK, TCGA-E9-A1R6, TCGA-AO-A0JA, TCGA-E2-A1LK, TCGA-A8-A07C, TCGA-PE-A5DE, TCGA-E2-A152, TCGA-B6-A0IN, TCGA-AN-A0FK, TCGA-EW-A2FW, TCGA-EW-A423, TCGA-D8-A1Y0, TCGA-AO-A12A, TCGA-BH-A0DE, TCGA-AR-A1AY, TCGA-AN-A0XU, TCGA-BH-A1F6, TCGA-A8-A099, TCGA-AR-A1AW, TCGA-A2-A0EQ, TCGA-GM-A3NY, TCGA-A8-A086, TCGA-A2-A1FZ, TCGA-GM-A3XG, TCGA-A2-A04W, TCGA-AN-A0XN, TCGA-AO-A1KP, TCGA-AC-A3YI, TCGA-A8-A07L, TCGA-AC-A8OP, TCGA-S3-AA17, TCGA-E2-A1LB, TCGA-EW-A1PD, TCGA-A2-A0D2, TCGA-AC-A62Y, TCGA-AO-A0JI, TCGA-B6-A0IO, TCGA-A2-A0T7, TCGA-E9-A1R5, TCGA-E9-A1NH, TCGA-AR-A24W, TCGA-AC-A6NO, TCGA-AC-A8OR, TCGA-A7-A4SE, TCGA-A8-A08L, TCGA-A8-A09G, TCGA-A2-A25D, TCGA-WT-AB44, TCGA-D8-A27P, TCGA-B6-A0I6, TCGA-B6-A0RV, TCGA-A2-A04X, TCGA-E9-A1RA, TCGA-AC-A3QP, TCGA-A7-A3IY, TCGA-A1-A0SN, TCGA-OL-A5RY, TCGA-E9-A1N4, TCGA-C8-A137, TCGA-EW-A1PC, TCGA-A8-A07U, TCGA-GM-A2D9, TCGA-EW-A1PE, TCGA-AN-A0FW, TCGA-D8-A145, TCGA-AR-A1AI, TCGA-AO-A1KQ, TCGA-E2-A15T, TCGA-S3-A6ZG, TCGA-A2-A0CW, TCGA-3C-AALJ, TCGA-A8-A081, TCGA-AO-A03P, TCGA-D8-A142, TCGA-AR-A24S, TCGA-AR-A24K, TCGA-BH-A0BL, TCGA-BH-A1EY, TCGA-E9-A1N9, TCGA-A2-A3XW, TCGA-BH-A0B5, TCGA-A2-A0T2, TCGA-B6-A1KN, TCGA-A7-A3RF, TCGA-E2-A14O, TCGA-A2-A0T6, TCGA-BH-A8G0, TCGA-BH-A1FH, TCGA-B6-A0IB, TCGA-E9-A1N3, TCGA-A2-A0D4, TCGA-BH-A0EI, TCGA-B6-A0IA, TCGA-JL-A3YX, TCGA-A8-A09W, TCGA-BH-A0BF, TCGA-C8-A131, TCGA-BH-A0B7, TCGA-AR-A1AL, TCGA-A7-A0CH, TCGA-D8-A1J8, TCGA-A8-A09D, TCGA-OL-A5RX, TCGA-BH-A0DT, TCGA-D8-A4Z1, TCGA-E2-A1IG, TCGA-B6-A0WT, TCGA-EW-A1PB, TCGA-A2-A0CY, TCGA-D8-A1JD, TCGA-BH-A0DI, TCGA-BH-A0H9, TCGA-E9-A1QZ, TCGA-A7-A3J1, TCGA-E2-A155, TCGA-A7-A4SB, TCGA-BH-A0H0, TCGA-LD-A7W5, TCGA-AN-A0AK, TCGA-EW-A1P1, TCGA-A7-A5ZV, TCGA-A8-A09Z, TCGA-A8-A093, TCGA-A2-A0EV, TCGA-E2-A1IJ, TCGA-AN-A0FF, TCGA-B6-A0RG, TCGA-AO-A12F, TCGA-BH-A0HP, TCGA-BH-A201, TCGA-E9-A54Y, TCGA-AC-A2FB, TCGA-A8-A0AB, TCGA-PL-A8LV, TCGA-AR-A1AQ, TCGA-AC-A2QI, TCGA-C8-A1HF, TCGA-E2-A15J, TCGA-AN-A0AL, TCGA-BH-A0H7, TCGA-AC-A2FF, TCGA-C8-A1HN, TCGA-OL-A66J, TCGA-A2-A0T0, TCGA-AR-A1AV, TCGA-A1-A0SJ, TCGA-BH-A0DL, TCGA-LL-A73Z, TCGA-AO-A0JB, TCGA-BH-A0B2, TCGA-A2-A0SY, TCGA-A2-A0D3, TCGA-BH-A0DK, TCGA-E2-A1IU, TCGA-A2-A3XX, TCGA-AR-A2LH, TCGA-D8-A1XG, TCGA-AO-A1KS, TCGA-OL-A66P, TCGA-E9-A5UP, TCGA-C8-A12K, TCGA-OL-A5S0, TCGA-BH-A0BW, TCGA-E9-A249, TCGA-A8-A07P, TCGA-A8-A09K, TCGA-D8-A146, TCGA-EW-A1J6, TCGA-AO-A125, TCGA-E2-A1B6, TCGA-BH-A0AU, TCGA-BH-A0AV, TCGA-A8-A07B, TCGA-AR-A0TZ, TCGA-D8-A1X9, TCGA-D8-A1JF, TCGA-D8-A1XW, TCGA-D8-A1JC, TCGA-LL-A5YO, TCGA-A1-A0SI, TCGA-B6-A2IU, TCGA-A8-A06Z, TCGA-BH-A0E1, TCGA-LL-A5YM, TCGA-AO-A0JJ, TCGA-BH-A0BD, TCGA-BH-A0BA, TCGA-BH-A0DG, TCGA-AR-A24T, TCGA-A8-A08S, TCGA-EW-A1P5, TCGA-A7-A426, TCGA-A2-A0YI, TCGA-GM-A4E0, TCGA-B6-A0I5, TCGA-GM-A3XL, TCGA-E9-A227, TCGA-B6-A0RH, TCGA-D8-A27R, TCGA-BH-A0BG, TCGA-EW-A1PH, TCGA-BH-A0E9, TCGA-E2-A14U, TCGA-AN-A0XP, TCGA-C8-A275, TCGA-AO-A12B, TCGA-C8-A8HR, TCGA-E2-A15L, TCGA-EW-A1PA, TCGA-A2-A3XS, TCGA-BH-A0DP, TCGA-BH-A18U, TCGA-MS-A51U, TCGA-BH-A0B6, TCGA-D8-A13Y, TCGA-BH-A0BO, TCGA-A8-A06X, TCGA-D8-A1JB, TCGA-E2-A15M, TCGA-3C-AAAU, TCGA-AR-A0U2, TCGA-AR-A5QN, TCGA-BH-A0HO, TCGA-BH-A18M, TCGA-EW-A1IX, TCGA-D8-A1JH, TCGA-E2-A1L8, TCGA-E2-A15R, TCGA-EW-A1J3, TCGA-D8-A141, TCGA-AO-A03M, TCGA-A7-A56D, TCGA-E9-A248, TCGA-AR-A24R, TCGA-GM-A2DB, TCGA-A7-A26G, TCGA-E2-A15P, TCGA-BH-AB28, TCGA-AN-A0FY, TCGA-PL-A8LX, TCGA-BH-A42V, TCGA-A8-A0AD, TCGA-3C-AALK, TCGA-E9-A2JT, TCGA-AO-A1KR, TCGA-A8-A0A9, TCGA-EW-A6S9, TCGA-A8-A08H, TCGA-AO-A0J7, TCGA-C8-A27A, TCGA-A2-A0CV, TCGA-A2-A0EW, TCGA-A8-A090, TCGA-E2-A1LI, TCGA-E9-A5FL, TCGA-B6-A0WX, TCGA-A2-A0YJ, TCGA-A2-A0T4, TCGA-AR-A1AH, TCGA-E9-A1RG, TCGA-GM-A2DL, TCGA-A8-A09R, TCGA-BH-A0C7, TCGA-BH-A1EW	1065
